{
  "capture_backend_name": "fake",
  "capture_duration_s": 1.0,
  "capture_latency_ms": 0.034285,
  "device_requested": "cpu",
  "device_used": "cpu",
  "end_to_end_latency_ms": 1173.230587,
  "error_message": null,
  "error_stage": null,
  "input": "fixture:mic-demo",
  "live_artifact_path": "artifacts/bench/s06-capstone-jDUUDN/mic-latency/live_runtime_result.json",
  "live_cli_exit_code": 0,
  "live_runtime_error_message": null,
  "live_runtime_error_stage": null,
  "live_runtime_status": "ok",
  "metadata": {
    "capture_backend_name": "fake",
    "capture_duration_s": 1.0,
    "clock_source": "perf_counter",
    "device_requested": "cpu",
    "device_used": "cpu",
    "live_command": [
      "/usr/bin/python3",
      "/mnt/c/Users/Danny/Documents/GitHub/CS4220-Capstone-Audio-Source-Separation/scripts/live/run_live_separation.py",
      "--source-mode",
      "mic",
      "--output-dir",
      "artifacts/bench/s06-capstone-jDUUDN/mic-latency",
      "--artifact-path",
      "artifacts/bench/s06-capstone-jDUUDN/mic-latency/live_runtime_result.json",
      "--chunk-duration-s",
      "1.0",
      "--sample-rate-hz",
      "22050",
      "--max-queue-depth",
      "64",
      "--decode-timeout-s",
      "30.0",
      "--device-requested",
      "cpu",
      "--device-used",
      "cpu",
      "--mode",
      "smoke",
      "--model-path",
      "artifacts/models/umx-live.pt",
      "--mic-backend",
      "fake",
      "--mic-device",
      "fixture:mic-demo",
      "--capture-duration-s",
      "1.0"
    ],
    "live_timeout_s": 120.0,
    "max_capture_latency_ms": null,
    "model_path": "artifacts/models/umx-live.pt",
    "source_mode": "mic"
  },
  "output_dir": "artifacts/bench/s06-capstone-jDUUDN/mic-latency",
  "phase": "complete",
  "status": "ok",
  "stderr": "",
  "timestamp": "2026-04-20T18:03:32.043610+00:00"
}
